{
  "upc_spec_version": "1.14.2",
  "corpus_id": "cor-f32e03145ac0",
  "title": "Fixture",
  "readme": "fixture",
  "created": "2026-08-17T12:00:00Z",
  "modified": "2026-08-17T12:00:00Z",
  "sections": {
    "sources": "sources/",
    "provenance": "provenance/events.jsonl",
    "sources_csv": "sources.csv",
    "extractions_csv": "extractions.csv",
    "index_html": "index.html",
    "extractions": "extractions/",
    "syntheses": "syntheses/"
  },
  "counts": {
    "sources": 1,
    "representations": 1,
    "extractions": 2,
    "generations": 1,
    "syntheses": 1
  },
  "sources": [
    {
      "source_id": "src-c76847068a0a",
      "path": "sources/note-migration/",
      "title": "Note",
      "primary_url": "",
      "sha256": "sha256:8389412e9ea792add58bb528fff88b6d201eb0573272bfc144091c01d365dabd"
    }
  ],
  "syntheses": [
    {
      "synthesis_id": "syn-908828cd665d",
      "path": "syntheses/syn-908828cd665d/",
      "title": "Answer"
    }
  ],
  "integrity": {
    "schema_hash": "sha256:1d6a645ff77f08d4b615275015d0f9df1e8ef10dc4607201e5fd56b141d41a16"
  }
}
