{
  "upc_spec_version": "1.14.2",
  "corpus_id": "cor-6ee859af382b",
  "title": "Fixture",
  "readme": "fixture",
  "created": "2026-08-17T12:00:00Z",
  "modified": "2026-08-17T12:00:00Z",
  "sections": {
    "sources": "sources/",
    "provenance": "provenance/events.jsonl",
    "sources_csv": "sources.csv",
    "extractions_csv": "extractions.csv",
    "index_html": "index.html"
  },
  "counts": {
    "sources": 2,
    "representations": 2,
    "extractions": 1,
    "generations": 0,
    "syntheses": 0
  },
  "syntheses": [],
  "integrity": {
    "schema_hash": "sha256:1d6a645ff77f08d4b615275015d0f9df1e8ef10dc4607201e5fd56b141d41a16"
  },
  "sources": [
    {
      "source_id": "src-949aacb64bb8",
      "path": "sources/note-copy/",
      "title": "Syndicated copy",
      "primary_url": "https://example.org/syndicated",
      "sha256": "sha256:8389412e9ea792add58bb528fff88b6d201eb0573272bfc144091c01d365dabd"
    },
    {
      "source_id": "src-c76847068a0a",
      "path": "sources/note-migration/",
      "title": "Note",
      "primary_url": "",
      "sha256": "sha256:8389412e9ea792add58bb528fff88b6d201eb0573272bfc144091c01d365dabd"
    }
  ]
}
