{
  "upc_spec_version": "1.15.0",
  "corpus_id": "cor-bb1e337e082b",
  "title": "Minimal UPC corpus",
  "readme": "Universal Provenance Corpus. Work only from ids resolved through the manifests. Quotations are verified byte-for-byte (spec/03).",
  "rules_note": "spec/00-overview.md",
  "created": "2026-08-17T12:00:00Z",
  "modified": "2026-08-17T12:00:00Z",
  "generated_by": {
    "tool": "pi-forge",
    "tool_version": "0.2.0"
  },
  "sections": {
    "sources": "sources/",
    "provenance": "provenance/events.jsonl",
    "sources_csv": "sources.csv",
    "extractions_csv": "extractions.csv",
    "index_html": "index.html"
  },
  "counts": {
    "sources": 1,
    "representations": 1,
    "extractions": 1,
    "generations": 0,
    "syntheses": 0
  },
  "sources": [
    {
      "source_id": "src-bdfe98b6a2a2",
      "path": "sources/note-2026-hello-provenance/",
      "title": "Hello, Provenance",
      "primary_url": "",
      "sha256": "sha256:cc693f89d386069e4ad7d3c2541422f7be596dad30f84d00ed46e53b3ac11238"
    }
  ],
  "syntheses": [],
  "integrity": {
    "schema_hash": "sha256:e175044324915d5ae7eb8183aa2d81e3ba03f50f7bb4550120855887678d0702"
  }
}
